{
  "$id": "http://localhost:8800/card.schema.json",
  "$schema": "https://json-schema.org/draft/2020-12/schema",
  "additionalProperties": false,
  "properties": {
    "back": {
      "anyOf": [
        {
          "$ref": "http://localhost:8800/sides/black.schema.json"
        },
        {
          "$ref": "http://localhost:8800/sides/purple.schema.json"
        }
      ]
    },
    "cardId": {
      "type": "integer"
    },
    "deck": {
      "enum": [
        "Thrusters",
        "Robonauts",
        "Refineries",
        "Reactors",
        "Radiators",
        "Generators",
        "GW/TW Thrusters",
        "Freighters",
        "Bernals",
        "Colonists"
      ]
    },
    "front": {
      "anyOf": [
        {
          "$ref": "http://localhost:8800/sides/white.schema.json"
        },
        {
          "$ref": "http://localhost:8800/sides/black.schema.json"
        }
      ]
    },
    "promotionColony": {
      "enum": [
        "C",
        "S",
        "M",
        "V",
        "D",
        "H",
        "Submarine",
        "Astrobiology",
        "Atmospheric",
        "Push"
      ]
    },
    "spectralType": {
      "enum": [
        "C",
        "S",
        "M",
        "V",
        "D",
        "H",
        "Any"
      ]
    }
  },
  "required": [
    "cardId",
    "deck",
    "front",
    "back"
  ],
  "title": "Card",
  "type": "object"
}