[{"cardId": 0, "deck": "Refineries", "front": {"name": "Atomic Layer Deposition", "mass": 2, "radHard": 2, "airEater": false, "supportRequirements": [{"type": "generator", "subtypes": ["e"]}]}, "back": {"name": "Ilmenite Semiconductor Film", "mass": 2, "radHard": 6, "airEater": false, "ability": "POWER GIRDLE: If used to industrialize a non-atmospheric site of size 8+, you permanently gain the Powersat faction privilege."}, "spectralType": "V"}, {"cardId": 0, "deck": "Refineries", "front": {"name": "Basalt Fiber Spinning", "mass": 3, "radHard": 5, "airEater": false, "supportRequirements": [{"type": "reactor", "subtypes": ["\u223f", "\ud83d\udca3", "X"]}]}, "back": {"name": "Von Neumann Santa Claus Machine", "mass": 2, "radHard": 5, "airEater": false, "ability": "DIVINING NUBOTS: -1 ISRU for Colocated ISRU platform."}, "spectralType": "S"}, {"cardId": 0, "deck": "Refineries", "front": {"name": "CVD Molding", "mass": 3, "radHard": 5, "airEater": false}, "back": {"name": "Carbonyl Volatilization", "mass": 2, "radHard": 5, "airEater": false, "ability": "THORIUM BREEDER: -3 to Colocated size rolls on S Sites."}, "spectralType": "M"}, {"cardId": 0, "deck": "Refineries", "front": {"name": "Carbo-Chlorination", "mass": 2, "radHard": 4, "airEater": false, "supportRequirements": [{"type": "generator", "subtypes": ["e"]}]}, "back": {"name": "Solar Carbotherm", "mass": 2, "radHard": 5, "airEater": false, "ability": "ARCOLOGY: Decommissioning of a robonaut is not needed when this is used to industrialize in the zones Mercury, Venus, Earth"}, "spectralType": "V"}, {"cardId": 0, "deck": "Refineries", "front": {"name": "Electroforming", "mass": 3, "radHard": 3, "airEater": false, "supportRequirements": [{"type": "generator", "subtypes": ["e"]}]}, "back": {"name": "Impact Mold Sinter", "mass": 3, "radHard": 5, "airEater": false, "ability": "FOAMED NICKEL: -1 to Colocated size rolls."}, "spectralType": "M"}, {"cardId": 0, "deck": "Refineries", "front": {"name": "Fluidized Bed", "mass": 3, "radHard": 4, "airEater": false, "supportRequirements": [{"type": "generator", "subtypes": ["e"]}]}, "back": {"name": "Atmospheric Scoop", "mass": 1, "radHard": 5, "airEater": true, "ability": "SCOOP: If operational, this card makes adjacent or colocated aerostat sites into [2 hydration]", "supportRequirements": [{"type": "generator", "subtypes": ["e"]}]}, "spectralType": "V"}, {"cardId": 0, "deck": "Refineries", "front": {"name": "Foamglass Sintering", "mass": 3, "radHard": 4, "airEater": false, "supportRequirements": [{"type": "generator", "subtypes": ["e"]}]}, "back": {"name": "Laser-Heated Pedestal Growth", "mass": 1, "radHard": 5, "airEater": false, "ability": "SUPERLENS: -1 to all Colocated raygun size rolls.", "supportRequirements": [{"type": "generator", "subtypes": ["e"]}]}, "spectralType": "D"}, {"cardId": 0, "deck": "Refineries", "front": {"name": "Froth Flotation", "mass": 3, "radHard": 5, "airEater": false, "supportRequirements": [{"type": "generator", "subtypes": ["e"]}]}, "back": {"name": "Femtochemistry", "mass": 2, "radHard": 8, "airEater": false, "ability": "SCAVENGING: If Colocated, doubles FTs during site refuel."}, "spectralType": "D"}, {"cardId": 0, "deck": "Refineries", "front": {"name": "ISRU Sabatier", "mass": 3, "radHard": 4, "airEater": false, "supportRequirements": [{"type": "generator", "subtypes": ["e"]}]}, "back": {"name": "Biophytolytic Algal Farm", "mass": 3, "radHard": 5, "airEater": false, "ability": "COMET LICHEN: -2 to Colocated size rolls on D Sites."}, "spectralType": "V"}, {"cardId": 0, "deck": "Refineries", "front": {"name": "In-Situ Leaching", "mass": 3, "radHard": 3, "airEater": false, "supportRequirements": [{"type": "reactor", "subtypes": ["\u223f", "\ud83d\udca3", "X"]}]}, "back": {"name": "Termite Nest", "mass": 1, "radHard": 3, "airEater": false, "ability": "MINE REVIVAL: As an op, remove a busted disk and place Claim on a Colocated Site of Size 2+.", "supportRequirements": [{"type": "reactor", "subtypes": ["\u223f", "\ud83d\udca3", "X"]}]}, "spectralType": "D"}, {"cardId": 0, "deck": "Refineries", "front": {"name": "Magma Electrolysis", "mass": 3, "radHard": 3, "airEater": false, "supportRequirements": [{"type": "generator", "subtypes": ["e"]}]}, "back": {"name": "Ionosphere Lasing", "mass": 2, "radHard": 6, "airEater": false, "ability": "IONOSAT: If used to industrialize an Atmospheric Site, permanently gain the Powersat faction privilege."}, "spectralType": "V"}, {"cardId": 0, "deck": "Refineries", "front": {"name": "Supercritical Drying", "mass": 1, "radHard": 5, "airEater": false, "supportRequirements": [{"type": "reactor", "subtypes": ["X"]}]}, "back": {"name": "Solid Flame", "mass": 0, "radHard": 5, "airEater": false, "ability": "JELLYBOTS: Colocated industrialization is a free action.", "supportRequirements": [{"type": "reactor", "subtypes": ["X"]}]}, "spectralType": "H"}]