[
  {
    "cardId": 165,
    "deck": "Freighters",
    "front": {
      "name": "Fission-Heated Steam",
      "mass": 0,
      "radHard": 5,
      "loadLimit": 2,
      "factoryLoadingOnly": true,
      "bonusPivots": 0,
      "supports": [
        {
          "type": "reactor",
          "subtypes": [
            "∿"
          ]
        }
      ]
    },
    "back": {
      "name": "Fission GCR",
      "mass": 1,
      "radHard": 6,
      "loadLimit": 6,
      "factoryLoadingOnly": false,
      "bonusPivots": 0,
      "ability": "Can liftoff/land on Sites that are less than size 6 without factory-assist.",
      "future": "EXOPLANET HUNT FUTURE: Req = Claim Sedna. Effect = (Endgame) 12 VP.",
      "supports": [
        {
          "type": "reactor",
          "subtypes": [
            "∿"
          ]
        }
      ]
    },
    "spectralType": "Any",
    "promotionColony": "M"
  },
  {
    "cardId": 168,
    "deck": "Freighters",
    "front": {
      "name": "Fusion Fragment Sail",
      "mass": 2,
      "radHard": 1,
      "loadLimit": 2,
      "factoryLoadingOnly": false,
      "bonusPivots": 1,
      "ability": "Immune to flares & radiation belts."
    },
    "back": {
      "name": "Antiproton Sail and Harvester",
      "mass": 2,
      "radHard": 9,
      "loadLimit": 6,
      "factoryLoadingOnly": false,
      "bonusPivots": 4,
      "ability": "+1 net thrust if starting its move on a radiation belt.",
      "future": "ANTIMATTER FUTURE: Req = Promoted Bernal with S Dirtside. Effects = double isotope refuel, 10 VP."
    },
    "spectralType": "V",
    "promotionColony": "M"
  },
  {
    "cardId": 169,
    "deck": "Freighters",
    "front": {
      "name": "HIIPER Beam Rider",
      "mass": 4,
      "radHard": 4,
      "loadLimit": 4,
      "factoryLoadingOnly": false,
      "bonusPivots": 1,
      "supports": [
        {
          "type": "generator",
          "subtypes": [
            "e"
          ]
        }
      ]
    },
    "back": {
      "name": "Magnetic Mirror Beam Rider",
      "mass": 3,
      "radHard": 6,
      "loadLimit": 5,
      "factoryLoadingOnly": false,
      "bonusPivots": 3,
      "ability": "Can liftoff/land on Sites that are less than size 6 without factory-assist.",
      "future": "STAR WISP FUTURE: Req = Promoted Freighter (End game) at either neutrino sunlens (6 VP) or EM sunlens = 11 VP.",
      "supports": [
        {
          "type": "generator",
          "subtypes": [
            "e"
          ]
        }
      ]
    },
    "spectralType": "V",
    "promotionColony": "Push"
  },
  {
    "cardId": 163,
    "deck": "Freighters",
    "front": {
      "name": "Inflatable Solar-Heated",
      "mass": 0,
      "radHard": 5,
      "loadLimit": 2,
      "factoryLoadingOnly": true,
      "bonusPivots": 0,
      "ability": "SOLAR HEATED: If not using Powersat, may move out only as far as the Ceres zone."
    },
    "back": {
      "name": "Archimedes Palmer Lens",
      "mass": 0,
      "radHard": 10,
      "loadLimit": 5,
      "factoryLoadingOnly": true,
      "bonusPivots": 0,
      "ability": "SOLAR HEATED: If not using Powersat, may move out only as far as the Jupiter zone.",
      "future": "TERRAFORM FUTURE: Req = Promoted Bernal at a non-Martian Atmospheric Dirtside. Effect = 8 VP."
    },
    "spectralType": "Any",
    "promotionColony": "C"
  },
  {
    "cardId": 166,
    "deck": "Freighters",
    "front": {
      "name": "Poodle Steam",
      "mass": 0,
      "radHard": 7,
      "loadLimit": 2,
      "factoryLoadingOnly": true,
      "bonusPivots": 0,
      "ability": "RADIOISOTOPE: +2 thrust if its move starts on a Factory."
    },
    "back": {
      "name": "D-Nanotube Dirt Launcher",
      "mass": 0,
      "radHard": 9,
      "loadLimit": 3,
      "factoryLoadingOnly": false,
      "bonusPivots": 0,
      "future": "BEANSTALK FUTURE: Req = 3+ Space Elevators built by any player. Effect (Endgame) = +3 VP for each Factory connected to a Space Elevator."
    },
    "spectralType": "Any",
    "promotionColony": "S"
  },
  {
    "cardId": 164,
    "deck": "Freighters",
    "front": {
      "name": "Rotary Dirt Launcher",
      "mass": 5,
      "radHard": 4,
      "loadLimit": 2,
      "factoryLoadingOnly": true,
      "bonusPivots": 0,
      "supports": [
        {
          "type": "reactor",
          "subtypes": [
            "∿"
          ]
        },
        {
          "type": "generator",
          "subtypes": [
            "e"
          ]
        }
      ]
    },
    "back": {
      "name": "KESTS Hoop Dirt Launcher",
      "mass": 15,
      "radHard": 8,
      "loadLimit": 15,
      "factoryLoadingOnly": true,
      "bonusPivots": 0,
      "future": "BEEHIVE ARK FUTURE: Req = Promoted Bernal anchored at a Synodic Comet. Effect = 7 VP.",
      "supports": [
        {
          "type": "reactor",
          "subtypes": [
            "∿"
          ]
        },
        {
          "type": "generator",
          "subtypes": [
            "e"
          ]
        }
      ]
    },
    "spectralType": "Any",
    "promotionColony": "C"
  },
  {
    "cardId": 167,
    "deck": "Freighters",
    "front": {
      "name": "Z-Pinch D-T / 6Li Fusion",
      "mass": 5,
      "radHard": 3,
      "loadLimit": 3,
      "factoryLoadingOnly": false,
      "bonusPivots": 1,
      "supports": [
        {
          "type": "reactor",
          "subtypes": [
            "X"
          ]
        },
        {
          "type": "generator",
          "subtypes": [
            "⟛"
          ]
        }
      ]
    },
    "back": {
      "name": "Z-Pinch 3He-D Target Fusion",
      "mass": 2,
      "radHard": 6,
      "loadLimit": 6,
      "factoryLoadingOnly": false,
      "bonusPivots": 2,
      "future": "GOLDEN APPLES FUTURE: Req = Industrialize Kreutz Sungrazer. Effects = Ignore solar flares, 14 VP.",
      "supports": [
        {
          "type": "reactor",
          "subtypes": [
            "X"
          ]
        },
        {
          "type": "generator",
          "subtypes": [
            "⟛"
          ]
        }
      ]
    },
    "spectralType": "V",
    "promotionColony": "H"
  }
]